{
  "v": 1,
  "agent": "cursor",
  "instance": "62f8a508d346a16fb37e22800d024812",
  "parent": null,
  "root_id": "1cef6db41044f552cd6c91d2060b7477",
  "account_id": null,
  "session_id": "2bc96fdf6398c8a01838dec3a2e1c9a7",
  "turn_id": null,
  "request_id": null,
  "host": "cli",
  "kind": "session_start",
  "source": "hook",
  "confidence": "exact",
  "t": 1791806400000
}
