{
  "v": 1,
  "agent": "claude",
  "instance": "2bc96fdf6398c8a01838dec3a2e1c9a7",
  "parent": null,
  "root_id": "1cef6db41044f552cd6c91d2060b7477",
  "account_id": "c6ca07cba169c06f5795d0395b257b19",
  "session_id": "2bc96fdf6398c8a01838dec3a2e1c9a7",
  "turn_id": null,
  "request_id": null,
  "host": "cli",
  "kind": "turn_start",
  "source": "hook",
  "confidence": "exact",
  "t": 1791806400000
}
